0017c1653be335ada6d841d408cd21c9,eltech,Основные определения ,20151120,20151120,основные определения 
7b4829e74daa88272c6dd647bc03f8d9,eltech,Эквивалентные преобразования схем. Параллельное соединение элементов электрических цепей ,20151120,20151120,эквивалентные преобразования схем. параллельное соединение элементов электрических цепей 
9e68f56af8a5504f7135251300b73179,eltech,Анализ электрических цепей постоянного тока с одним источником энергии,20151120,20151120,анализ электрических цепей постоянного тока с одним источником энергии
50359957dd4bbce75b799c1227132c58,eltech,Анализ сложных электрических цепей с несколькими источниками энергии ,20151120,20151120,анализ сложных электрических цепей с несколькими источниками энергии 
f0f13729f06f578645f3b04000a2d3a3,eltech,Нелинейные электрические цепи постоянного тока ,20151120,20151120,нелинейные электрические цепи постоянного тока 
74ff6905be5573e516e0613785946b24,eltech,Электрические цепи однофазного переменного тока ,20151120,20151120,электрические цепи однофазного переменного тока 
981606bd21279d73c69eb3a9790f9cf0,eltech,Сопротивление в цепи синусоидального тока ,20151120,20151120,6.4. сопротивление в цепи синусоидального тока
24f83c806820db89fecf5a95ab602912,eltech,Мощность в цепи синусоидального тока ,20151120,20151120,6.10. мощность в цепи синусоидального тока
677e433e441b797d973af3183c6e4e96,eltech,Трехфазные цепи ,20151120,20151120,трехфазные цепи 
9e666cd90649f6ba4e365768ac041e3e,eltech,Переходные процессы в линейных электрических цепях,20151120,20151120,переходные процессы в линейных электрических цепях
519d19ee76681ede9f59cf192551004a,eltech,Магнитные цепи ,20151120,20151120,магнитные цепи 
02c423718a94c7adabd1866a2539447d,eltech,Трансформаторы ,20151120,20151120,трансформаторы 
2f3f8cc500711f0d5916456d14993a7a,eltech,Электрические машины постоянного тока,20151120,20151120,электрические машины постоянного тока
29f428c6122c23c24578dcf89de8d67f,eltech,Электрические машины переменного тока,20151120,20151120,электрические машины переменного тока
903915007d7c8dd5c33147ae1f092d78,eltech,"Асинхронные двигатели. Конструкция, принцип действия ",20151120,20151120,"12.2. асинхронные двигатели. конструкция, принцип действия "
0e13a10e945e60757be3d3152ee50e19,eltech,"Синхронные двигатели. Конструкция, принцип действия ",20151120,20151120,"12.6. синхронные двигатели. .  конструкция, принцип действия "
975999b89a02be18f75542789b96ce08,eltech,Информационные электрические машины,20151120,20151120,информационные электрические машины
